{
  "title": "Yanina Bellini Saibene", 
  "type": "blog", 
  "url": "https://yabellini.netlify.app/blog/", 
  "rss_feed": "https://yabellini.netlify.app/categories/rstats/index.xml",
  "description": "Writings about my interests and my work: R, education, communities of practice, research, data science, experiences, talks and some more personal stuff.",
  "language": "en", 
  "authors": [ 
    {
      "name": "Yanina Bellini Saibene", 
      "social_media": [{
         "mastodon": "@yabellini@fosstodon.org",
         "bluesky": "@yabellini.bsky.social",
         "github": "yabellini",
         "instagram": "yanina.bellini",
         "youtube": "yabellini",
         "website": "https://yabellini.netlify.app/",
         "linkedin": "/in/yabellini/",
         "orcid": "0000-0002-4522-7466"
      }]
    }
  ]
}
