{
  "title": "Cynthia D'Angelo",
  "type": "blog",
  "url": "https://cynthiadangelo.com/",
  "rss_feed": "https://cynthiadangelo.com/feed/",
  "photo_url": "https://cynthiadangelo.com/wp-content/uploads/2012/12/img_0008.jpg?w=333",
  "description": "ramblings about my adventures",
  "language": "en",
  "authors": [
    {
      "name": "Cynthia D'Angelo",
      "social_media": [
        {
          "twitter": "dapostrophe",
          "website": "http://cynthiadangelo.com/"
        }
      ]
    }
  ]
}
