{
  "title": "Meeting People Where They R",
  "type": "blog",
  "url": "https://silvia.rbind.io/",
  "rss_feed": "https://silvia.rbind.io/categories/r/index.xml",
  "language": "en",
  "authors": [
    {
      "name": "Silvia Canel√≥n",
      "social_media": [{
        "twitter": "spcanelon",
        "mastodon": "@spcanelon@fosstodon.org",
        "github": "spcanelon",
        "linkedin": "spcanelon/"
      }]
    }
  ]
}
