{
  "title": "Lore Abad", 
  "type": "blog", 
  "url": "https://loreabad6.github.io/", 
  "rss_feed": "https://loreabad6.github.io/index.xml",
  "photo_url": "https://loreabad6.github.io/AbadL.jpg", 
  "description": "My adventures with RSpatial",
  "language": "en", 
  "authors": [ 
    {
      "name": "Lorena Abad", 
      "social_media": [{
         "twitter": "@loreabad6",
         "mastodon": "@loreabad6@fosstodon.org",
         "github": "loreabad6",
         "researchgate": "Lorena-Abad",
         "linkedin": "lorena-abad",
         "orcid": "0000-0003-0554-734X"
      }]
    }
  ]
}
