{
  "title": "Surrounded by Data", 
  "type": "blog", 
  "url": "https://surroundedbydata.netlify.app", 
  "photo_url": "https://surroundedbydata.netlify.app/about_files/Veerle_klein.jpg", 
  "description": "Stories about the data that can be found all around us, in Dutch and English",
  "language": "en (required)", 
  "authors": [ 
    {
      "name": "Veerle van Son", 
      "social_media": [{
         "twitter": "veerlevanson",
         "bluesky": "veerlevanson.bsky.social",
         "github": "veerlevanson",
         "instagram": "veerle.van.son",
         "linkedin": "veerlevanson",
         "meetup": "rladies-den-bosch"
      }]
    }
  ]
}
