{
  "title": "Macarena Quiroga",
  "type": "blog",
  "url": "https://macarenaquiroga.netlify.app",
  "rss_feed": "https://macarenaquiroga.netlify.app/tag/rstats/index.xml",
  "photo_url": "https://macarenaquiroga.netlify.app/author/macarena-quiroga/avatar_hu2dcaef447beb41a9ecf37ab13d81ec8c_130063_270x270_fill_q75_lanczos_center.jpg",
  "description": "Linguistics, education, and data science with R",
  "language": "es",
  "authors": [
    {
      "name": "Macarena Quiroga",
      "social_media": [{
         "twitter": "_msquiroga",
         "mastodon": "@macarenaquiroga@datasci.social",
         "github": "msquiroga89",
         "linkedin": "macarena-quiroga"
      }]
    }
  ]
}
