{
  "title": "Julia Silge",
  "type": "blog",
  "url": "https://juliasilge.com",
  "rss_feed": "https://juliasilge.com/categories/rstats/index.xml",
  "photo_url": "https://github.com/juliasilge.png",
  "description": "A data science blog by Julia Silge",
  "language": "en",
  "authors": [
    {
      "name": "Julia Silge",
      "social_media": [{
         "twitter": "juliasilge",
         "mastodon": "@juliasilge@fosstodon.org",
         "bluesky": "juliasilge.com",
         "github": "juliasilge",
         "youtube": "juliasilge",
         "website": "https://juliasilge.com",
         "linkedin": "juliasilge",
         "orcid": "0000-0002-3671-836X"
      }]
    }
  ]
}
