{
  "title": "Shel Kariuki's blog",
  "type": "blog",
  "url": "https://shelkariuki.netlify.app",
  "photo_url": "https://shelkariuki.netlify.app/author/avatar_hubc1f6cfd80a3e5aa5176d464d1c32c28_52181_270x270_fill_q90_lanczos_center.jpeg",
  "description": "Data Analytics Consultant based in Nairobi, Kenya",
  "language": "en",
  "authors": [
    {
      "name": "Shel Kariuki",
      "social_media": [{
        "twitter": "Shel_Kariuki",
        "github": "Shelmith-Kariuki"
      }]
    }
  ]
}
